{
  "contractVersion": "0.1-draft",
  "kind": "command-vector",
  "id": "vector.command-vector.remove-node.nested",
  "description": "Removing a nested node splices only that node; the inverse insertion restores it at its original slot position.",
  "initial": {
    "contractVersion": "0.1-draft",
    "dependencyLock": {
      "blocks": [
        {
          "revision": "block-r1",
          "type": "studio.vector/section",
          "version": "1.0.0"
        },
        {
          "revision": "block-r1",
          "type": "studio.vector/text",
          "version": "1.0.0"
        }
      ],
      "theme": {
        "id": "studio.vector/theme",
        "revision": "theme-r1",
        "version": "1.0.0"
      }
    },
    "id": "vector.blueprint",
    "kind": "blueprint",
    "label": {
      "defaultMessage": "Vector Blueprint",
      "key": "studio.vector/blueprint"
    },
    "model": {
      "id": "studio.vector/model",
      "revision": "model-r1",
      "version": "1.0.0"
    },
    "owner": {
      "id": "studio.vector/suite",
      "version": "0.1.0-alpha.0"
    },
    "revision": "blueprint-r1",
    "roots": [
      {
        "authoring": {
          "mode": "structural"
        },
        "bindings": {},
        "id": "section-a",
        "properties": {},
        "slots": {
          "main": [
            {
              "authoring": {
                "mode": "designer"
              },
              "bindings": {},
              "id": "text-a",
              "properties": {},
              "slots": {},
              "type": "studio.vector/text",
              "version": "1.0.0"
            },
            {
              "authoring": {
                "mode": "designer"
              },
              "bindings": {},
              "id": "text-b",
              "properties": {},
              "slots": {},
              "type": "studio.vector/text",
              "version": "1.0.0"
            }
          ]
        },
        "type": "studio.vector/section",
        "version": "1.0.0"
      }
    ],
    "status": "draft",
    "version": "1.0.0"
  },
  "command": {
    "artifactId": "vector.blueprint",
    "baseStateVersion": 0,
    "contractVersion": "0.1-draft",
    "id": "vector.command.remove-node.nested",
    "kind": "command",
    "payload": {
      "nodeId": "text-a"
    },
    "sessionGeneration": "session-r1",
    "type": "studio.command/remove-node"
  },
  "expect": {
    "document": {
      "contractVersion": "0.1-draft",
      "dependencyLock": {
        "blocks": [
          {
            "revision": "block-r1",
            "type": "studio.vector/section",
            "version": "1.0.0"
          },
          {
            "revision": "block-r1",
            "type": "studio.vector/text",
            "version": "1.0.0"
          }
        ],
        "theme": {
          "id": "studio.vector/theme",
          "revision": "theme-r1",
          "version": "1.0.0"
        }
      },
      "id": "vector.blueprint",
      "kind": "blueprint",
      "label": {
        "defaultMessage": "Vector Blueprint",
        "key": "studio.vector/blueprint"
      },
      "model": {
        "id": "studio.vector/model",
        "revision": "model-r1",
        "version": "1.0.0"
      },
      "owner": {
        "id": "studio.vector/suite",
        "version": "0.1.0-alpha.0"
      },
      "revision": "blueprint-r1",
      "roots": [
        {
          "authoring": {
            "mode": "structural"
          },
          "bindings": {},
          "id": "section-a",
          "properties": {},
          "slots": {
            "main": [
              {
                "authoring": {
                  "mode": "designer"
                },
                "bindings": {},
                "id": "text-b",
                "properties": {},
                "slots": {},
                "type": "studio.vector/text",
                "version": "1.0.0"
              }
            ]
          },
          "type": "studio.vector/section",
          "version": "1.0.0"
        }
      ],
      "status": "draft",
      "version": "1.0.0"
    }
  },
  "inverse": {
    "artifactId": "vector.blueprint",
    "baseStateVersion": 1,
    "contractVersion": "0.1-draft",
    "id": "vector.inverse.remove-node.nested",
    "kind": "command",
    "payload": {
      "destination": {
        "parentNodeId": "section-a",
        "position": 0,
        "slot": "main"
      },
      "node": {
        "authoring": {
          "mode": "designer"
        },
        "bindings": {},
        "id": "text-a",
        "properties": {},
        "slots": {},
        "type": "studio.vector/text",
        "version": "1.0.0"
      }
    },
    "sessionGeneration": "session-r1",
    "type": "studio.command/insert-node"
  }
}
